{
  "sourceLanguage": "ko",
  "targetLanguage": "ja",
  "name": "Japanese Dates",
  "description": "Japanese words for days, weeks, months, years, and relative dates.",
  "thumbnailUrl": "https://packs.vocatab.com/thumbnails/ko-ja/basics/dates.svg",
  "tags": [
    "basics",
    "dates",
    "time"
  ],
  "localizations": {
    "ko": {
      "name": "일본어 날짜",
      "description": "일, 주, 월, 연도와 상대 날짜를 나타내는 일본어 단어 모음입니다."
    },
    "ja": {
      "name": "日本語の日付",
      "description": "日・週・月・年と相対的な日付を表す日本語の単語集です。"
    }
  },
  "words": [
    {
      "term": "今日",
      "reading": "きょう",
      "meaning": "오늘",
      "example": "きょうは いい てんきですね。"
    },
    {
      "term": "明日",
      "reading": "あした",
      "meaning": "내일",
      "example": "あした また あいましょう。"
    },
    {
      "term": "昨日",
      "reading": "きのう",
      "meaning": "어제",
      "example": "きのうは いそがしかったです。"
    },
    {
      "term": "明後日",
      "reading": "あさって",
      "meaning": "모레"
    },
    {
      "term": "一昨日",
      "reading": "おととい",
      "meaning": "그저께"
    },
    {
      "term": "毎日",
      "reading": "まいにち",
      "meaning": "매일",
      "example": "まいにち にほんごを べんきょうしています。"
    },
    {
      "term": "今週",
      "reading": "こんしゅう",
      "meaning": "이번 주",
      "example": "こんしゅうは よていが いっぱいです。"
    },
    {
      "term": "先週",
      "reading": "せんしゅう",
      "meaning": "지난주"
    },
    {
      "term": "来週",
      "reading": "らいしゅう",
      "meaning": "다음 주",
      "example": "らいしゅうから りょこうに いきます。"
    },
    {
      "term": "今月",
      "reading": "こんげつ",
      "meaning": "이번 달"
    },
    {
      "term": "先月",
      "reading": "せんげつ",
      "meaning": "지난달"
    },
    {
      "term": "来月",
      "reading": "らいげつ",
      "meaning": "다음 달"
    },
    {
      "term": "今年",
      "reading": "ことし",
      "meaning": "올해",
      "example": "ことしの もくひょうは なんですか。"
    },
    {
      "term": "去年",
      "reading": "きょねん",
      "meaning": "작년"
    },
    {
      "term": "来年",
      "reading": "らいねん",
      "meaning": "내년"
    },
    {
      "term": "月曜日",
      "reading": "げつようび",
      "meaning": "월요일",
      "example": "げつようびから しごとです。"
    },
    {
      "term": "火曜日",
      "reading": "かようび",
      "meaning": "화요일"
    },
    {
      "term": "水曜日",
      "reading": "すいようび",
      "meaning": "수요일"
    },
    {
      "term": "木曜日",
      "reading": "もくようび",
      "meaning": "목요일"
    },
    {
      "term": "金曜日",
      "reading": "きんようび",
      "meaning": "금요일",
      "example": "きんようびの よるは たのしみです。"
    },
    {
      "term": "土曜日",
      "reading": "どようび",
      "meaning": "토요일"
    },
    {
      "term": "日曜日",
      "reading": "にちようび",
      "meaning": "일요일"
    },
    {
      "term": "週末",
      "reading": "しゅうまつ",
      "meaning": "주말",
      "example": "しゅうまつは ゆっくり やすみます。"
    },
    {
      "term": "曜日",
      "reading": "ようび",
      "meaning": "요일",
      "example": "きょうは なんようびですか。"
    },
    {
      "term": "日付",
      "reading": "ひづけ",
      "meaning": "날짜",
      "example": "しょるいに ひづけを かいてください。"
    },
    {
      "term": "誕生日",
      "reading": "たんじょうび",
      "meaning": "생일",
      "example": "たんじょうび おめでとうございます。"
    },
    {
      "term": "祝日",
      "reading": "しゅくじつ",
      "meaning": "공휴일",
      "example": "あしたは しゅくじつなので やすみです。"
    }
  ]
}
